============================================================
   Tang Dynasty, V6.2.168116
   Copyright (c) 2012-2025 Anlogic Inc.
   Executable = D:/Anlogic/TD_6.2.1_Engineer_6.2.168.116/bin/run.exe
   Built at =   16:32:07 Jun 12 2025
   Run by =     Administrator
   Run Date =   Sat Aug  9 19:32:46 2025

   Run on =     PC-20230215EHPW
============================================================
RUN-1002 : start command "import_device eagle_s20.db -package EG4S20BG256"
RUN-1001 : Using default speed grade: NA
ARC-1001 : Device Initialization.
ARC-1001 : ------------------------------------------------------------------
ARC-1001 :            OPTION            |          IO          |   SETTING   
ARC-1001 : ------------------------------------------------------------------
ARC-1001 :   cso_b/cclk/mosi/miso/dout  |  T3/R11/T10/P10/S11  |    gpio    
ARC-1001 :             done             |         P13          |    gpio    
ARC-1001 :           program_b          |          T2          |  dedicate  
ARC-1001 :        tdi/tms/tck/tdo       |   C12/A15/C14/E14    |  dedicate  
ARC-1001 : ------------------------------------------------------------------
ARC-1004 : Device setting, marked 5 dedicate IOs in total.
RUN-1002 : start command "set_param flow ooc_flow on"
RUN-1002 : start command "read_verilog -file auto_created_cwc2_watcherInst.sv"
HDL-1007 : analyze verilog file auto_created_cwc2_watcherInst.sv
HDL-1007 : analyze verilog file D:\Anlogic\TD_6.2.1_Engineer_6.2.168.116\ip/apm/apm_cwc/apm_cwc.sv
Copyright (c) 1998-2019 The OpenSSL Project.  All rights reserved.
This product includes software developed by the OpenSSL Project
for use in the OpenSSL Toolkit (http://www.openssl.org/)
Copyright (C) 1995-1998 Eric Young (eay@cryptsoft.com)
All rights reserved.
This product includes cryptographic software written by Eric Young (eay@cryptsoft.com)
HDL-1007 : undeclared symbol '**', assumed default net type '**' in D:\Anlogic\TD_6.2.1_Engineer_6.2.168.116\ip/apm/apm_cwc/apm_cwc.sv(492)
HDL-1007 : undeclared symbol '**', assumed default net type '**' in D:\Anlogic\TD_6.2.1_Engineer_6.2.168.116\ip/apm/apm_cwc/apm_cwc.sv(493)
HDL-1007 : back to file 'D:\Anlogic\TD_6.2.1_Engineer_6.2.168.116\ip/apm/apm_cwc/apm_cwc.sv' in D:\Anlogic\TD_6.2.1_Engineer_6.2.168.116\ip/apm/apm_cwc/apm_cwc.sv(1)
HDL-1007 : elaborate module auto_created_cwc2 in auto_created_cwc2_watcherInst.sv(1)
HDL-1007 : elaborate module ** in D:\Anlogic\TD_6.2.1_Engineer_6.2.168.116\ip/apm/apm_cwc/apm_cwc.sv(3)
HDL-1007 : elaborate module ** in D:\Anlogic\TD_6.2.1_Engineer_6.2.168.116\ip/apm/apm_cwc/apm_cwc.sv(212)
HDL-1007 : elaborate module ** in D:\Anlogic\TD_6.2.1_Engineer_6.2.168.116\ip/apm/apm_cwc/apm_cwc.sv(573)
HDL-1007 : elaborate module ** in D:\Anlogic\TD_6.2.1_Engineer_6.2.168.116\ip/apm/apm_cwc/apm_cwc.sv(629)
HDL-1007 : elaborate module ** in D:\Anlogic\TD_6.2.1_Engineer_6.2.168.116\ip/apm/apm_cwc/apm_cwc.sv(629)
HDL-1007 : elaborate module ** in D:\Anlogic\TD_6.2.1_Engineer_6.2.168.116\ip/apm/apm_cwc/apm_cwc.sv(788)
HDL-1007 : elaborate module ** in D:\Anlogic\TD_6.2.1_Engineer_6.2.168.116\ip/apm/apm_cwc/apm_cwc.sv(1025)
HDL-1007 : elaborate module ** in D:\Anlogic\TD_6.2.1_Engineer_6.2.168.116\ip/apm/apm_cwc/apm_cwc.sv(1025)
HDL-1007 : elaborate module ** in D:\Anlogic\TD_6.2.1_Engineer_6.2.168.116\ip/apm/apm_cwc/apm_cwc.sv(1025)
HDL-1007 : elaborate module ** in D:\Anlogic\TD_6.2.1_Engineer_6.2.168.116\ip/apm/apm_cwc/apm_cwc.sv(1025)
HDL-1007 : elaborate module ** in D:\Anlogic\TD_6.2.1_Engineer_6.2.168.116\ip/apm/apm_cwc/apm_cwc.sv(1025)
HDL-1007 : elaborate module ** in D:\Anlogic\TD_6.2.1_Engineer_6.2.168.116\ip/apm/apm_cwc/apm_cwc.sv(1025)
HDL-1007 : elaborate module ** in D:\Anlogic\TD_6.2.1_Engineer_6.2.168.116\ip/apm/apm_cwc/apm_cwc.sv(995)
HDL-1007 : extracting RAM for identifier '**' in D:\Anlogic\TD_6.2.1_Engineer_6.2.168.116\ip/apm/apm_cwc/apm_cwc.sv(1010)
HDL-1200 : Current top model is auto_created_cwc2
HDL-1100 : Inferred 1 RAMs.
RUN-1002 : start command "optimize_rtl"
RUN-1001 : Open license file D:/Anlogic/TD_6.2.1_Engineer_6.2.168.116/license/Anlogic.lic
SYN-1001 : Stage 1 | Optimize RTL
SYN-1001 : Stage 1.1 | Check Design Sanity
SYN-1001 : End Stage 1.1 | Check Design Sanity; Time: 0.001069s wall, 0.000000s user + 0.000000s system = 0.000000s CPU (n/a%); Memory(MB): used = 99, reserved = 101, peak = 99;

SYN-1079 : finish stage Check Design Sanity. Total instances: 2621, Total nets: 6276.

SYN-1001 : Stage 1.2 | Initialize Design
SYN-1001 : End Stage 1.2 | Initialize Design; Time: 0.133591s wall, 0.125000s user + 0.000000s system = 0.125000s CPU (93.6%); Memory(MB): used = 99, reserved = 101, peak = 99;

SYN-1079 : finish stage Initialize Design. Total instances: 1079, Total nets: 3833.

SYN-1001 : Stage 1.3 | Flatten Module
SYN-1011 : Flatten model auto_created_cwc2
SYN-1050 : Instances selected by 'keep_hierarchy':
RUN-1001 : ------------------------------------------------------------------------------------------------------------
RUN-1001 :           instance           |  keep_hierarchy  |         down_module         |         file(line)          
RUN-1001 : ------------------------------------------------------------------------------------------------------------
RUN-1001 :   wrapper_cwc_top/U_cwc_ram  |       true       | anlogic05_cwc_ram(DATA_...  | D:\Anlogic\TD_6.2.1_Eng...  
RUN-1001 : ------------------------------------------------------------------------------------------------------------
SYN-1001 : End Stage 1.3 | Flatten Module; Time: 0.017007s wall, 0.015625s user + 0.000000s system = 0.015625s CPU (91.9%); Memory(MB): used = 99, reserved = 101, peak = 99;

SYN-1079 : finish stage Flatten Module. Total instances: 1944, Total nets: 3389.

SYN-1001 : Stage 1.4 | Uniform Instance
SYN-1001 : End Stage 1.4 | Uniform Instance; Time: 0.006995s wall, 0.000000s user + 0.015625s system = 0.015625s CPU (223.4%); Memory(MB): used = 95, reserved = 92, peak = 99;

SYN-1079 : finish stage Uniform Instance. Total instances: 1733, Total nets: 3178.

SYN-1001 : Stage 1.5 | Optimize Design
SYN-1032 : 3169/2 useful/useless nets, 1731/2 useful/useless insts
SYN-1016 : Merged 94 instances.
SYN-1026 : Infer Logic BRAM(wrapper_cwc_top/U_cwc_ram/ramread0_syn_4)
	 port mode: single port
	 port a size: 1024 x 54	 write mode: READBEFOREWRITE
	 port b size: 1024 x 54	 write mode: NORMAL
SYN-1023 : Infer 0 Logic DRAMs, 1 Logic BRAMs.
SYN-1016 : Merged 16 instances.
SYN-1001 : End Stage 1.5 | Optimize Design; Time: 0.138316s wall, 0.140625s user + 0.000000s system = 0.140625s CPU (101.7%); Memory(MB): used = 102, reserved = 101, peak = 102;

SYN-1079 : finish stage Optimize Design. Total instances: 2623, Total nets: 2993.

SYN-1001 : Stage 1.6 | Optimize Iteratively
SYN-1014 : Optimize round 1
SYN-1017 : Remove 3 const input seq instances
SYN-1020 : Optimized 12 distributor mux.
SYN-1015 : Optimize round 1, 117 better
SYN-1014 : Optimize round 2
SYN-1016 : Merged 6 instances.
SYN-1015 : Optimize round 2, 12 better
SYN-3010 : Optimized 2 DFF(s)
SYN-1014 : Optimize round 1
SYN-1015 : Optimize round 1, 0 better
SYN-1001 : End Stage 1.6 | Optimize Iteratively; Time: 0.685504s wall, 0.656250s user + 0.000000s system = 0.656250s CPU (95.7%); Memory(MB): used = 116, reserved = 111, peak = 120;

SYN-1079 : finish stage Optimize Iteratively. Total instances: 2616, Total nets: 2986.

SYN-1001 : Stage 1.7 | Check Design
SYN-1001 : End Stage 1.7 | Check Design; Time: 0.000552s wall, 0.015625s user + 0.000000s system = 0.015625s CPU (n/a%); Memory(MB): used = 116, reserved = 111, peak = 120;

SYN-1079 : finish stage Check Design. Total instances: 2616, Total nets: 2986.

SYN-1001 : End Stage 1 | Optimize RTL; Time: 0.983408s wall, 0.953125s user + 0.015625s system = 0.968750s CPU (98.5%); Memory(MB): used = 116, reserved = 111, peak = 120;

SYN-1079 : finish stage Optimize RTL. Total instances: 2616, Total nets: 2986.

RUN-1002 : start command "map_macro"
SYN-1001 : Stage 2 | Map Reg
SYN-1001 : End Stage 2 | Map Reg; Time: 0.035250s wall, 0.031250s user + 0.000000s system = 0.031250s CPU (88.7%); Memory(MB): used = 116, reserved = 111, peak = 120;

SYN-1079 : finish stage Map Reg. Total instances: 2616, Total nets: 2986.

SYN-1001 : Stage 3 | Map IO
SYN-2001 : Map 0 IOs to PADs of model 'auto_created_cwc2'
SYN-1001 : End Stage 3 | Map IO; Time: 0.002128s wall, 0.000000s user + 0.000000s system = 0.000000s CPU (n/a%); Memory(MB): used = 116, reserved = 111, peak = 120;

SYN-1001 : Stage 4 | Map Macro
RUN-1002 : start command "update_pll_param -module auto_created_cwc2"
SYN-2501 : Processed 0 LOGIC_BUF instances.
SYN-6562 WARNING: The init value of "wrapper_cwc_top/U_cwc_ram/ramread0_syn_4(D:\Anlogic\TD_6.2.1_Engineer_6.2.168.116\ip/apm/apm_cwc/apm_cwc.sv(0))" will be ignored since gate eram_init is set to off
SYN-2571 : Optimize after map_dsp, round 1
SYN-2571 : Optimize after map_dsp, round 1, 0 better
SYN-1001 : Throwback 4 control mux instances
SYN-2501 : Optimize round 1
SYN-1016 : Merged 3 instances.
SYN-2501 : Optimize round 1, 66 better
SYN-2501 : Optimize round 2
SYN-2501 : Optimize round 2, 0 better
SYN-2501 : Optimize round 1
SYN-2501 : Optimize round 1, 0 better
SYN-2501 : Map 22 macro adder(s)
SYN-1016 : Merged 7 instances.
SYN-1001 : End Stage 4 | Map Macro; Time: 0.136692s wall, 0.140625s user + 0.000000s system = 0.140625s CPU (102.9%); Memory(MB): used = 117, reserved = 112, peak = 120;

SYN-1079 : finish stage Map Macro. Total instances: 3105, Total nets: 3482.

RUN-1002 : start command "map"
SYN-1001 : Stage 5 | Map Gate
SYN-2581 : Mapping with K=5, #lut = 389 (3.16), #lev = 4 (1.33), #crit_level = 0
SYN-2551 : Post LUT mapping optimization.
SYN-2581 : Mapping with K=5, #lut = 394 (3.14), #lev = 3 (1.30), #crit_level = 0
SYN-3001 : Logic optimization opt = 0.12 sec, map = 0.04 sec, post map opt = 0.14 sec.
SYN-1001 : End Stage 5 | Map Gate; Time: 0.338298s wall, 0.281250s user + 0.000000s system = 0.281250s CPU (83.1%); Memory(MB): used = 125, reserved = 118, peak = 125;

RUN-1002 : start command "pack"
SYN-1001 : Packing model "auto_created_cwc2" ...
SYN-4010 : Pack lib has 59 rtl pack models with 26 top pack blocks
SYN-1014 : Optimize round 1
SYN-1015 : Optimize round 1, 0 better
SYN-4002 : Packing 1059 DFF/LATCH to SEQ ...
SYN-4009 : Pack 6 carry chain into lslice
SYN-4007 : Packing 170 adder to BLE ...
SYN-4008 : Packed 170 adder and 24 SEQ to BLE.
SYN-4007 : Packing 0 gate4 to BLE ...
SYN-4008 : Packed 0 gate4 and 0 SEQ to BLE.
RUN-1002 : start command "report_qor -step gate -file gate.qor"
RUN-1002 : start command "start_timer"
-----------------------------------------------------------
| QoR metrics               |         value               |
-----------------------------------------------------------
| Timing                    |                             |
|     Setup WNS             |        14805                |
|     Setup TNS             |            0                |
|     Num of violated S-EP  |            0                |
|     Hold WNS              |          694                |
|     Hold TNS              |            0                |
|     Num of violated H-EP  |            0                |
-----------------------------------------------------------
| Utilization               |                             |
|     #registers            |         1035                |
|     #luts                 |          394                |
|     #lut1                 |           20                |
|     #lut1(~A)             |           20                |
|     #slices               |          110                |
|     slices percentage     |        1.12%                |
|     #RAMs                 |            6                |
|     #DSPs                 |            0                |
|     #f7mux                |        0.00%                |
|     #MACROs               |           21                |
|     #insts in MACRO       |          110                |
-----------------------------------------------------------
| kept_net                  |                             |
|     #syn_keep             |          344                |
|     #keep_hier            |           67                |
|     #dont_touch           |            0                |
|     #mark_debug           |            0                |
|     #max_fanout_keep      |            0                |
|     #async_reg            |            0                |
-----------------------------------------------------------
| Top 10% datanet fanout#   |         8.62                |
| dff(single fanout)->dff   |          338                |
| dff(single fanout)->dram  |            0                |
-----------------------------------------------------------
| Over-quota path num*      |                             |
|     Total                 |            0                |
-----------------------------------------------------------
| Rent**                    |                             |
-----------------------------------------------------------
Note*: Over-quota path shows the over-path-level-threshold path number of each clock.
       The clock will not be shown if no path is with path level over the threshold.
       The threshold is defined as worst path_margin / 800ps.
Note**: Rent shows the rent exponent value of the modules whose rent value exceeds the threshold.
        Only modules under top are reported, and the threshold is defined as 0.7.

Logic Level Distribution
------------------------------------------------------------------
  Clock        |  Period            |  0    |  1    |  2   |  3
------------------------------------------------------------------
  DeriveClock  |  20.000ns (50MHz)  |  525  |  259  |  82  |  63
------------------------------------------------------------------
Note: The table count the worst 100000 paths, each endpoint count only one time.(929 paths analyzed)

Hierarchical Rent Exponent Report
+----------------------------------------------------------------------------+
|Inst              |Model             |Rent     |Cell     |Pin     |Term     |
+----------------------------------------------------------------------------+
|top               |auto_created_cwc2 |0.11     |2300     |6089    |6        |
|  wrapper_cwc_top |top_cwc_hub_1     |0.63     |2300     |6089    |345      |
+----------------------------------------------------------------------------+
Note: Cell represents total number of cells inside module; Pin represents total number of pins
      which have net connection inside module; Term represents total number of PIs and POs of module.
      Rent represents the relationship between number of terms and number of cells in module.
      A module with higher rent corresponds to highly connected logic and strong connectivity with others.
Report gate stage QoR done.

SYN-1001 : The design has 60 dangling syn_keep insts.
RUN-1002 : start command "report_area -file auto_created_cwc2_gate.area"
RUN-1001 : standard
***Report Model: auto_created_cwc2 Device: EG4S20BG256***

IO Statistics
#IO                       345   out of    188  183.51%
  #input                  321
  #output                  24
  #inout                    0

LUT Statistics
#Total_luts               394
  #lut4                   309
  #lut5                    85
  #lut6                     0
  #lut5_mx41                0
  #lut4_alu1b               0

Utilization Statistics
#lut                      614   out of  19600    3.13%
#reg                     1059   out of  19600    5.40%
#bram                       6   out of     64    9.38%
  #bram9k                   6
  #fifo9k                   0
#bram32k                    0   out of     16    0.00%
#dsp                        0   out of     29    0.00%
#pad                        0   out of    188    0.00%
#pll                        0   out of      4    0.00%
#gclk                       0   out of     16    0.00%

RUN-1002 : start command "export_db -mode ooc auto_created_cwc2_ooc.db"
RUN-1001 : Exported /
RUN-1001 : Exported libs
RUN-1001 : Exported entities
RUN-1001 : Exported ports
RUN-1001 : Exported pins
RUN-1001 : Exported instances
RUN-1001 : Exported nets
RUN-1001 : Exported buses
RUN-1001 : Exported models
